{
  "id": "syn-13003-001",
  "tenant_id": "tenant-synthetic-credit-union",
  "object_type": "pilot_scope",
  "version": 1,
  "status": "qualified",
  "classification": "synthetic",
  "owner_id": "user-synthetic-owner",
  "created_at": "2026-07-22T12:00:00Z",
  "updated_at": "2026-07-22T12:00:00Z",
  "effective_at": null,
  "expires_at": null,
  "source_refs": [
    "source-synthetic-001"
  ],
  "evidence_refs": [
    "evidence-13003-001"
  ],
  "approval_refs": [],
  "control_refs": [
    "CTRL-HUMAN-AUTHORITY",
    "CTRL-TENANT-ISOLATION"
  ],
  "audit_ref": "audit-13003-001",
  "correlation_id": "corr-13003-001",
  "idempotency_key": "idem-13003-001",
  "name": "Synthetic pilot scope",
  "description": "Synthetic V1 fixture for documentation validation and demo-safe testing.",
  "scope": {
    "institution": "Synthetic Community Credit Union",
    "included": [
      "single controlled workflow"
    ],
    "excluded": [
      "autonomous regulated approval",
      "unapproved production write"
    ]
  },
  "economics": {
    "currency": "USD",
    "basis": "synthetic",
    "amount": 0
  },
  "metrics": {
    "baseline": 0,
    "target": 1
  },
  "dependencies": [],
  "next_action": "Complete documented review",
  "due_at": null,
  "confidence": 1.0,
  "data_state": "synthetic"
}